{
  "$schema": "https://json-schema.org/draft/2020-12/schema",
  "$id": "https://rattleapp.de/schemas/source-mapping.schema.json",
  "title": "Rattle Source Mapping",
  "description": "Output of the rattle-ingest workflow — the first link in the chain rattle-ingest → rattle-pricelist-analysis → rattle-suggest-config → rattle-apply-config. A REVIEWABLE map from an arbitrary customer source file (Excel / CSV / ERP export / PDF pricelist) onto Rattle entities. It carries NO configuration decisions: only the detected sheet shape, one mapping per source column, every column that could not be mapped, and the blockers a human must answer before rattle-suggest-config may run. Never fabricate a standard option, a price, or a part number — emit a placeholder plus a blocker instead.",
  "type": "object",
  "required": ["source", "sheet_shape", "columns"],
  "properties": {
    "tenant": {
      "type": "string",
      "minLength": 1,
      "description": "Tenant slug (matches the RATTLE_API_KEY_<TENANT> convention). Optional — ingestion is a local, read-only step."
    },
    "generated_at": {
      "type": "string",
      "format": "date-time",
      "description": "ISO 8601 / RFC 3339 UTC timestamp."
    },
    "source": { "$ref": "#/$defs/source" },
    "sheet_shape": { "$ref": "#/$defs/sheet_shape" },
    "columns": {
      "type": "array",
      "description": "One entry per source column that received a role. Every column of the source file MUST appear either here or in `unmapped_columns` — never silently drop a column.",
      "items": { "$ref": "#/$defs/column_mapping" }
    },
    "unmapped_columns": {
      "type": "array",
      "description": "Columns deliberately left unmapped. Presence here is the audit trail proving the column was seen and considered.",
      "items": { "$ref": "#/$defs/unmapped_column" }
    },
    "blockers": {
      "type": "array",
      "description": "Hard stops. While this array is non-empty, rattle-suggest-config MUST NOT be run: the source does not contain enough information to build a correct BOM-aware configuration. Each blocker states the placeholder that was emitted in place of a fabricated value and the question a human must answer.",
      "items": { "$ref": "#/$defs/blocker" }
    },
    "warnings": {
      "type": "array",
      "description": "Soft findings — low-confidence mappings, coerced values, assumed separators. Non-blocking, but every one of them is a review item.",
      "items": { "$ref": "#/$defs/warning" }
    },
    "normalized_rows_path": {
      "type": "string",
      "description": "Path to the emitted normalized-rows.json (a JSON array of flat objects). That array is the input to skills/rattle-pricelist-analysis/scripts/detect_anti_patterns.py and to rattle-suggest-config."
    },
    "normalized_row_count": { "type": "integer", "minimum": 0 },
    "notes": {
      "type": "array",
      "items": { "type": "string" },
      "description": "Free-form remarks for the human reviewer (assumptions, provenance, follow-ups)."
    }
  },
  "additionalProperties": false,
  "$defs": {
    "decimal_string": {
      "description": "Backend serialises prices as decimal strings (Numeric(10,2) → string). Accept either numeric or canonical 2-decimal string. Mirrors recommendation.schema.json#/$defs/decimal_string.",
      "oneOf": [
        { "type": "string", "pattern": "^[0-9]+(\\.[0-9]{1,2})?$" },
        { "type": "number", "minimum": 0 }
      ]
    },
    "confidence": {
      "type": "number",
      "minimum": 0,
      "maximum": 1,
      "description": "0.00–1.00. < 0.60 MUST also raise a `low-confidence-mapping` warning and set `review_required: true`."
    },
    "source": {
      "type": "object",
      "required": ["path", "file_type"],
      "description": "Provenance of the ingested file. Reading is delegated to rattle_api.source.read_source (Excel/PDF/Word) or the stdlib csv/json readers — rattle-ingest does not reimplement file parsing.",
      "properties": {
        "path": { "type": "string", "minLength": 1 },
        "filename": { "type": "string" },
        "file_type": {
          "enum": ["xlsx", "xlsm", "csv", "json", "pdf", "docx", "txt"]
        },
        "read_via": {
          "type": "string",
          "description": "Reader used, e.g. 'openpyxl', 'csv', 'rattle_api.source.read_source'."
        },
        "sheet_name": {
          "type": ["string", "null"],
          "description": "Worksheet actually profiled. Null for non-sheet formats."
        },
        "sheet_names": {
          "type": "array",
          "items": { "type": "string" },
          "description": "All worksheets present. More than one raises a `multiple-sheets-present` warning — ingest one sheet per mapping."
        },
        "header_row": {
          "type": "integer",
          "minimum": 0,
          "description": "0-based index of the row treated as the header. Anything other than 0 raises an `assumed-header-row` warning."
        },
        "row_count": { "type": "integer", "minimum": 0, "description": "Data rows, excluding the header." },
        "column_count": { "type": "integer", "minimum": 0 },
        "checksum_sha256": {
          "type": "string",
          "pattern": "^[a-f0-9]{64}$",
          "description": "Hex SHA-256 of the source bytes. Lets a later re-ingest prove the source did not change."
        }
      },
      "additionalProperties": false
    },
    "sheet_shape": {
      "type": "object",
      "required": ["id", "confidence"],
      "description": "The detected shape of the sheet. Each id has exactly one documented normalization strategy — see skills/rattle-ingest/references/sheet-shapes.md.",
      "properties": {
        "id": {
          "enum": [
            "one-row-per-product",
            "one-row-per-option",
            "one-row-per-bom-line",
            "wide-variant-matrix",
            "mixed"
          ]
        },
        "confidence": { "$ref": "#/$defs/confidence" },
        "evidence": {
          "type": "array",
          "items": { "type": "string" },
          "description": "Deterministic signals that drove the guess (cardinality, dtype, header shape) — never the header alone."
        },
        "candidates": {
          "type": "array",
          "description": "Ranked runners-up. Two candidates within 0.15 of each other raise a `sheet-shape-ambiguous` warning.",
          "items": {
            "type": "object",
            "required": ["id", "confidence"],
            "properties": {
              "id": {
                "enum": [
                  "one-row-per-product",
                  "one-row-per-option",
                  "one-row-per-bom-line",
                  "wide-variant-matrix",
                  "mixed"
                ]
              },
              "confidence": { "$ref": "#/$defs/confidence" }
            },
            "additionalProperties": false
          }
        },
        "normalization": {
          "type": "string",
          "description": "One-line restatement of the normalization strategy applied (e.g. 'pivot variant columns into (group, option) pairs; one normalized row per cell')."
        }
      },
      "additionalProperties": false
    },
    "column_role": {
      "description": "The 24 column roles. Full detection heuristics: skills/rattle-ingest/references/column-roles.md.",
      "enum": [
        "product_name",
        "product_sku",
        "area_name",
        "group_name",
        "option_name",
        "option_price",
        "base_price",
        "currency",
        "recommended_flag",
        "quantity",
        "unit",
        "part_number",
        "part_name",
        "parent_part_number",
        "bom_factor",
        "number_min",
        "number_max",
        "number_step",
        "number_unit",
        "constraint_exclusion",
        "description",
        "image_ref",
        "locale",
        "ignore"
      ]
    },
    "target_entity": {
      "description": "Rattle entity the column feeds. `none` = the column informs parsing or review but is never written (e.g. `currency`, which ProductCreateRequest accepts but IGNORES — currency is derived from the company base price list).",
      "enum": [
        "product",
        "area",
        "group",
        "option",
        "part",
        "part_placement",
        "bom_item",
        "constraint",
        "none"
      ]
    },
    "transform": {
      "description": "Deterministic cell transform applied on normalization. `decimal_de` parses '1.234,56 €' → '1234.56'; `decimal_en` parses '1,234.56' → '1234.56'; `boolean_marker` maps x / ✓ / • / ja / yes → true; `standard_marker` maps Serie / serienmäßig / Standard / S → recommended=true; `header_to_option_name` and `cell_to_option_price` are the wide-variant-matrix pivot pair.",
      "enum": [
        "none",
        "trim",
        "decimal_de",
        "decimal_en",
        "strip_currency",
        "to_integer",
        "to_number",
        "boolean_marker",
        "standard_marker",
        "split_list",
        "locale_code",
        "header_to_option_name",
        "cell_to_option_price",
        "constant"
      ]
    },
    "column_mapping": {
      "type": "object",
      "required": ["index", "header", "role", "confidence"],
      "properties": {
        "index": { "type": "integer", "minimum": 0, "description": "0-based column index in the source sheet." },
        "header": { "type": "string", "description": "Verbatim header cell. May be empty — an empty header is not a reason to drop the column." },
        "role": { "$ref": "#/$defs/column_role" },
        "confidence": { "$ref": "#/$defs/confidence" },
        "target_entity": { "$ref": "#/$defs/target_entity" },
        "target_field": {
          "type": "string",
          "description": "Field on the target entity. MUST be a field that exists on the backend create/update schema (e.g. option.price, part.part_number, option.number_unit). Rattle has NO Product.sku field — carry a customer article number in product.integration_metadata.<key>."
        },
        "transform": { "$ref": "#/$defs/transform" },
        "transform_arg": {
          "type": "string",
          "description": "Argument for the transform (e.g. the constant value, the list separator, the integration_metadata key)."
        },
        "derived": {
          "type": "object",
          "description": "Values the mapping ATTACHES to every cell of this column rather than reading from it. Required for wide-variant-matrix pivots, where the header is the option name and the group must be supplied by the reviewer.",
          "properties": {
            "product_name": { "type": "string" },
            "area_name": { "type": "string" },
            "group_name": { "type": "string" },
            "option_name": { "type": "string" },
            "is_multi": { "type": "boolean" }
          },
          "additionalProperties": false
        },
        "dtype": {
          "description": "Deterministic dtype guess from the VALUES, not the header.",
          "enum": ["string", "number", "integer", "boolean", "date", "empty", "mixed"]
        },
        "non_null": { "type": "integer", "minimum": 0 },
        "cardinality": { "type": "integer", "minimum": 0 },
        "samples": {
          "type": "array",
          "maxItems": 5,
          "items": { "type": "string" },
          "description": "Up to 5 verbatim value samples — the evidence a reviewer needs to confirm or reject the role."
        },
        "candidates": {
          "type": "array",
          "description": "Ranked alternative roles the profiler considered.",
          "items": {
            "type": "object",
            "required": ["role", "confidence"],
            "properties": {
              "role": { "$ref": "#/$defs/column_role" },
              "confidence": { "$ref": "#/$defs/confidence" },
              "signals": { "type": "array", "items": { "type": "string" } }
            },
            "additionalProperties": false
          }
        },
        "evidence": { "type": "string", "description": "Why this role won." },
        "review_required": {
          "type": "boolean",
          "description": "True whenever confidence < 0.60, or the mapping invents structure the source does not state (a pivot's group_name, for example)."
        },
        "note": { "type": "string" }
      },
      "additionalProperties": false
    },
    "unmapped_column": {
      "type": "object",
      "required": ["index", "header", "reason"],
      "properties": {
        "index": { "type": "integer", "minimum": 0 },
        "header": { "type": "string" },
        "reason": {
          "type": "string",
          "minLength": 1,
          "description": "Why no role applied. 'Unknown' is an acceptable reason; silence is not."
        },
        "samples": { "type": "array", "maxItems": 5, "items": { "type": "string" } },
        "suggestion": {
          "type": "string",
          "description": "What a human could do with it (e.g. 'internal cost column — confirm it is not customer-facing before discarding')."
        }
      },
      "additionalProperties": false
    },
    "blocker": {
      "type": "object",
      "required": ["blocker_id", "message"],
      "description": "A hard stop. Ingestion NEVER invents the missing value: it emits a placeholder and records the question. `pattern_id` is present whenever the blocker is an instance of a catalogued anti-pattern (skills/rattle-configurator/references/anti-patterns.md).",
      "properties": {
        "blocker_id": {
          "enum": [
            "missing-standard-variant",
            "missing-price-basis",
            "missing-part-number",
            "unresolved-column-role",
            "ambiguous-sheet-shape",
            "merged-header-cells",
            "multi-value-cell",
            "unparseable-value",
            "no-product-identified"
          ]
        },
        "pattern_id": {
          "description": "Anti-pattern id from skills/rattle-configurator/references/anti-patterns.md (mirrored in rattle_api.knowledge.ANTI_PATTERNS and skills/rattle-pricelist-analysis/scripts/detect_anti_patterns.py). Set it whenever the blocker is an instance of a catalogued anti-pattern — the downstream rattle-pricelist-analysis report indexes on it, so the two findings merge cleanly. Keep this enum in sync with the catalogue.",
          "enum": [
            "implicit-base-config",
            "addon-only-options",
            "description-area-smell",
            "addon-only-software-modules",
            "per-unit-priced-row"
          ]
        },
        "message": { "type": "string", "minLength": 1 },
        "location": {
          "type": "string",
          "description": "Pointer into this document or the source (e.g. 'columns[3]', \"Preisliste!D1\", 'rows[7].Aufpreis')."
        },
        "evidence": { "type": "string", "description": "Verbatim cell / header text that triggered the blocker." },
        "placeholder": {
          "type": "string",
          "description": "The placeholder emitted INSTEAD of a fabricated value, e.g. 'PLACEHOLDER: 17 Zoll (standard variant — unconfirmed)'. Never a guessed price, name, or part number."
        },
        "question": {
          "type": "string",
          "description": "The single question a human must answer to clear the blocker, e.g. 'Which wheel size ships as standard, and at what BOM cost?'"
        },
        "related_rules": {
          "type": "array",
          "items": { "type": "string" },
          "description": "Rule ids from skills/rattle-configurator/references/configuration-rules.md (e.g. explicit-options-for-all-variants)."
        }
      },
      "additionalProperties": false
    },
    "warning": {
      "type": "object",
      "required": ["code", "message"],
      "properties": {
        "code": {
          "enum": [
            "low-confidence-mapping",
            "unmapped-column",
            "duplicate-header",
            "empty-column",
            "assumed-header-row",
            "multiple-sheets-present",
            "sheet-shape-ambiguous",
            "currency-not-writable",
            "part-cost-rounded",
            "decimal-separator-assumed",
            "merged-cells-detected",
            "multi-value-cell",
            "placeholder-emitted",
            "value-truncated"
          ]
        },
        "message": { "type": "string", "minLength": 1 },
        "location": { "type": "string" },
        "column_index": { "type": "integer", "minimum": 0 }
      },
      "additionalProperties": false
    }
  }
}
